{
  "$schema": "https://json-schema.org/draft/2020-12/schema",
  "additionalProperties": false,
  "properties": {
    "input_preservation": {
      "enum": [
        "passed",
        "failed",
        "not_performed"
      ]
    },
    "private_gate": {
      "enum": [
        "performed",
        "not_performed"
      ]
    },
    "private_gate_result": {
      "enum": [
        "conclusive",
        "inconclusive",
        "failed",
        "not_performed"
      ]
    },
    "public_promotion_status": {
      "const": "prohibited_pending_user_approval"
    },
    "resolved_field_count": {
      "minimum": 0,
      "type": "integer"
    },
    "resolved_fields": {
      "items": {
        "type": "string"
      },
      "type": "array",
      "uniqueItems": true
    },
    "schema_version": {
      "const": 1
    },
    "trial_count": {
      "minimum": 0,
      "type": "integer"
    },
    "unresolved_field_count": {
      "minimum": 0,
      "type": "integer"
    },
    "unresolved_fields": {
      "items": {
        "type": "string"
      },
      "type": "array",
      "uniqueItems": true
    },
    "variant_count": {
      "const": 5
    }
  },
  "required": [
    "schema_version",
    "private_gate",
    "private_gate_result",
    "input_preservation",
    "variant_count",
    "trial_count",
    "resolved_field_count",
    "unresolved_field_count",
    "resolved_fields",
    "unresolved_fields",
    "public_promotion_status"
  ],
  "title": "M07 redacted public result",
  "type": "object"
}
